0,1,2,3,4,5,6
2795,"图书馆、情报与
文献学",黑龙江大学,青年基金项目,信息网络传播与数字图书馆权利研究,12YJC870035,周丽霞
2796,"图书馆、情报与
文献学",湖北工业大学,青年基金项目,虚拟社会网络环境下微博的集群行为感知与规律研究,12YJC870009,胡昌龙
2797,"图书馆、情报与
文献学",淮南师范学院,青年基金项目,国际比较视野下的高校图书馆社会服务动力机制研究,12YJC870028,阳国华
2798,"图书馆、情报与
文献学",吉林大学,青年基金项目,图书馆、档案馆数字化服务融合研究,12YJC870032,张卫东
2799,"图书馆、情报与
文献学",兰州商学院,青年基金项目,"云计算环境下数字图书馆云服务信息化平台架构策略与用
户服务模式研究",12YJC870019,马晓亭
2800,"图书馆、情报与
文献学",辽宁工程技术大学,青年基金项目,三网融合环境区域数字图书馆云服务研究,12YJC870030,张龙昌
2801,"图书馆、情报与
文献学",南昌航空大学,青年基金项目,我国学术信息资源开放存取政策研究,12YJC870033,张耀坤
2802,"图书馆、情报与
文献学",南京理工大学,青年基金项目,"面向农村的“三农知识”自动问答服务系统构建的关键问
题研究",12YJC870036,朱鹏
2803,"图书馆、情报与
文献学",南京邮电大学,青年基金项目,基于中文信息处理技术的古籍整理研究,12YJC870008,顾磊
2804,"图书馆、情报与
文献学",宁波大学,青年基金项目,科技期刊评价中利益相关者的关系特征分析及其改进,12YJC870024,王灵芝
2805,"图书馆、情报与
文献学",山东理工大学,青年基金项目,长句检索中信息查询扩展技术研究,12YJC870001,白如江
2806,"图书馆、情报与
文献学",上海大学,青年基金项目,学术虚拟社区知识交流的模式和规律研究,12YJC870006,丁敬达
2807,"图书馆、情报与
文献学",上海大学,青年基金项目,清末民初私人藏书家与近代图书馆学的形成,12YJC870018,马刘凤
2808,"图书馆、情报与
文献学",上海大学,青年基金项目,场域.文化.公共空间：大学图书馆公共性研究,12YJC870020,倪代川
2809,"图书馆、情报与
文献学",上海大学,青年基金项目,清中叶民间书业研究——以江南地区为中心,12YJC870034,郑幸
2810,"图书馆、情报与
文献学",上海海事大学,青年基金项目,构建上海国际航运中心文献信息支撑体系研究,12YJC870017,吕长红
2811,"图书馆、情报与
文献学",上海理工大学,青年基金项目,面向云计算环境下科技文献共享的语义集成模型研究,12YJC870037,朱小栋
2812,"图书馆、情报与
文献学",首都师范大学,青年基金项目,新时期俄罗斯图书馆事业研究,12YJC870027,文凤
2813,"图书馆、情报与
文献学",四川大学,青年基金项目,科学-技术关联探测方法研究——专利引文视角,12YJC870013,李睿
2814,"图书馆、情报与
文献学",苏州大学,青年基金项目,云仓储环境下数字资源长期保存协作模式研究,12YJC870015,李卓卓
2815,"图书馆、情报与
文献学",天津师范大学,青年基金项目,基于群体智慧的微博客信息可信度评价机制研究,12YJC870025,王树义
2816,"图书馆、情报与
文献学",武汉大学,青年基金项目,社会性标签系统中用户信息搜寻行为研究,12YJC870011,姜婷婷
2817,"图书馆、情报与
文献学",武汉大学,青年基金项目,文华图专对中国图书馆学教育本土化的贡献研究,12YJC870021,彭敏惠
2818,"图书馆、情报与
文献学",武汉理工大学,青年基金项目,基于社交网络及情境感知的移动互联网信息推荐研究,12YJC870002,曹洪江
2819,"图书馆、情报与
文献学",西藏大学,青年基金项目,西藏地区民间苯教经典调查及分类研究,12YJC870007,更尕易西
2820,"图书馆、情报与
文献学","郑州航空工业管理
学院",青年基金项目,引用认同的相关规律及其应用研究,12YJC870022,苏芳荔
2821,"图书馆、情报与
文献学",中国人民公安大学,青年基金项目,基于综合情报平台的重大社会安全事件预警防范机制研究,12YJC870003,陈亮
2822,"图书馆、情报与
文献学",中山大学,青年基金项目,信息生态视角下的网络信息资源优化配置研究,12YJC870004,陈明红
2823,外国文学,北京师范大学,规划基金项目,"巴特勒和西苏理论比较研究：以身体、语言、女性性为中
心",12YJA752010,郭乙瑶
2824,外国文学,大连外国语学院,规划基金项目,美国南方文学在中国的译介研究（1958-2010）,12YJA752022,王春
2825,外国文学,东南大学,规划基金项目,美国经典作家的科技伦理研究,12YJA752028,吴兰香
2826,外国文学,福建师范大学,规划基金项目,日本精神的实象与虚象：“大和魂”的建构与变异,12YJA752012,胡稹
2827,外国文学,复旦大学,规划基金项目,近代日本作家的中国因缘与中国意象（1915-1945年）,12YJA752031,徐静波
2828,外国文学,广东外语外贸大学,规划基金项目,英国宪章派文学及其历史命运,12YJA752029,肖四新
2829,外国文学,广西师范大学,规划基金项目,当代欧美诗学：范式转型与理论话语史论,12YJA752020,麦永雄
2830,外国文学,哈尔滨工程大学,规划基金项目,"美国当代哥特小说的社会美学审视——以史蒂芬·金和安
妮·赖斯的哥特小说为例",12YJA752026,王晓姝
2831,外国文学,杭州师范大学,规划基金项目,"战争文学与女性意识——美国一战女作家的战争文学创作
研究",12YJA752015,李公昭
2832,外国文学,河南大学,规划基金项目,现象学视阈下的文学印象主义,12YJA752021,孙晓青
2833,外国文学,湖南科技大学,规划基金项目,美国作家苏珊格拉斯佩尔戏剧研究,12YJA752017,凌建娥
2834,外国文学,湖南理工学院,规划基金项目,非裔口述文化传统与非裔美国小说关系研究,12YJA752033,易立君
2835,外国文学,湖南师范大学,规划基金项目,阿瑟？韦利与中国典籍翻译,12YJA752001,陈惠
2836,外国文学,华南师范大学,规划基金项目,美国当代作家诺曼？梅勒作品研究,12YJA752008,谷红丽
2837,外国文学,济南大学,规划基金项目,夏目漱石文学的知识分子叙事研究,12YJA752004,邓传俊
2838,外国文学,暨南大学,规划基金项目,庶民学派文学批评探析,12YJA752002,陈义华
2839,外国文学,江南大学,规划基金项目,托妮.莫里森作品的历史书写研究,12YJA752013,荆兴梅
2840,外国文学,井冈山大学,规划基金项目,美国“深度意象派”诗歌研究,12YJA752034,尹根德
2841,外国文学,辽宁师范大学,规划基金项目,"作为完整的艺术系统的——俄罗斯文学“莫斯科-彼得堡
”题材研究",12YJA752007,傅星寰
2842,外国文学,辽宁师范大学,规划基金项目,元小说视域下的霍克斯小说研究,12YJA752009,谷野平
2843,外国文学,青岛科技大学,规划基金项目,文本政治学：文化唯物主义莎评研究,12YJA752032,许勤超
2844,外国文学,山东大学,规划基金项目,日本现代女性文学的主题表达与价值取向,12YJA752030,肖霞
2845,外国文学,苏州大学,规划基金项目,日本中世歌学歌论核心概念“幽玄”的诗学阐释,12YJA752014,李东军
2846,外国文学,苏州大学,规划基金项目,奥尼尔戏剧的文化叙事,12YJA752027,卫岭
2847,外国文学,泰山医学院,规划基金项目,英国当代“编史元小说”研究,12YJA752018,刘爱琴
2848,外国文学,同济大学,规划基金项目,欧洲元素对美国“南方文艺复兴”本土特征的构建,12YJA752016,李杨
2849,外国文学,同济大学,规划基金项目,莎士比亚十四行诗中的伦理真相,12YJA752024,王改娣
2850,外国文学,西北大学,规划基金项目,"哈罗德.品特“胁迫喜剧”的审美机制及其文化建构价值
研究",12YJA752003,崔雅萍
2851,外国文学,徐州师范大学,规划基金项目,族群与政治权力:文学人类学视角下的勃朗特研究,12YJA752006,冯茜
2852,外国文学,湛江师范学院,规划基金项目,多元文化语境下的博尔赫斯研究,12YJA752025,王钦峰
2853,外国文学,浙江工业大学,规划基金项目,"意大利文学与教育名著Cuore（《爱的教育》）中国百年
翻译研究",12YJA752035,张建青
2854,外国文学,浙江理工大学,规划基金项目,"威廉·詹姆斯，实用主义哲学与罗伯特·弗罗斯特诗学与
诗歌研究",12YJA752011,何庆机
2855,外国文学,中国人民大学,规划基金项目,现代作者理论研究,12YJA752005,刁克利
2856,外国文学,中南民族大学,规划基金项目,当代非裔美国新现实主义小说研究,12YJA752019,罗虹
2857,外国文学,重庆邮电大学,规划基金项目,杰弗里.哈特曼文学批评思想研究,12YJA752023,王凤
2858,外国文学,百色学院,青年基金项目,"跨境民族文学与中越民族文学交流——以越南与中国广西
的跨境民族为例",12YJC752012,黄玲
2859,外国文学,北京外国语大学,青年基金项目,20世纪英美女性城市小说中的现代性叙事,12YJC752037,尹星
2860,外国文学,北京外国语大学,青年基金项目,当代英国流散小说研究,12YJC752039,张峰
2861,外国文学,北京外国语大学,青年基金项目,英国马克思主义文论史,12YJC752047,赵国新
2862,外国文学,大连大学,青年基金项目,伽达默尔诗化哲学研究,12YJC752028,宋阳
2863,外国文学,大连外国语学院,青年基金项目,小泉八云的日本观与东方主义文化思潮,12YJC752041,张瑾
2864,外国文学,东北师范大学,青年基金项目,《平家物语》中的战争与文化,12YJC752004,池睿
2865,外国文学,对外经济贸易大学,青年基金项目,"意象的磁场——对法国作家于连？格拉克的作品主题的亲
缘性研究",12YJC752033,阎雪梅
2866,外国文学,哈尔滨师范大学,青年基金项目,伯纳德马拉默德小说的伦理主题研究,12YJC752019,李莉莉
2867,外国文学,河北师范大学,青年基金项目,20世纪印度女性文学中的宗教与政治,12YJC752029,王春景
2868,外国文学,衡水学院,青年基金项目,哈罗德·布鲁姆“内在性”诗学研究,12YJC752008,高永
2869,外国文学,华南理工大学,青年基金项目,当代加拿大华裔英文小说研究,12YJC752010,龚云霞
2870,外国文学,华中师范大学,青年基金项目,易卜生戏剧地理基因问题研究,12YJC752006,杜雪琴
2871,外国文学,淮海工学院,青年基金项目,雪莱的灵魂诗学,12YJC752021,刘晓春
2872,外国文学,吉林大学,青年基金项目,多元文化视野下西班牙语裔美国文学研究,12YJC752022,吕娜
2873,外国文学,江南大学,青年基金项目,消费主义的兴起与20世纪20年代美国小说研究,12YJC752043,张俊萍
2874,外国文学,兰州交通大学,青年基金项目,西方马克思主义文学批评的空间传统,12YJC752036,杨有庆
2875,外国文学,乐山师范学院,青年基金项目,“重复”之美：斯潘诺斯的诗学研究,12YJC752048,郑宇
2876,外国文学,南方医科大学,青年基金项目,简约而不简单——美国“极简主义”文学流派研究,12YJC752031,王中强
2877,外国文学,南京大学,青年基金项目,桑顿？怀尔德的寓言叙事研究,12YJC752005,但汉松
2878,外国文学,南京大学,青年基金项目,卢梭文学创作的审美研究,12YJC752013,黄小彦
2879,外国文学,南京大学,青年基金项目,在中国处境下对希伯来经典的跨文本阅读与诠释,12YJC752025,孟振华
2880,外国文学,南京邮电大学,青年基金项目,后殖民视角下的澳大利亚作家朱迪思.赖特研究,12YJC752001,毕宙嫔
2881,外国文学,宁波大学,青年基金项目,当代视域中的荷尔德林悲剧思想,12YJC752009,葛体标
2882,外国文学,山东大学,青年基金项目,文化研究视角下的维涅·叶罗费耶夫小说,12YJC752026,皮野
2883,外国文学,山东经济学院,青年基金项目,琳达·哈琴的后现代主义诗学研究,12YJC752003,陈后亮
2884,外国文学,山东经济学院,青年基金项目,当代美国犹太文学的犹太性及文化样本意义,12YJC752007,高婷
2885,外国文学,上海外国语大学,青年基金项目,霍夫曼小说的文化视角研究,12YJC752020,梁锡江
2886,外国文学,上海外国语大学,青年基金项目,危机时代的创伤叙事,12YJC752024,梅丽
2887,外国文学,深圳大学,青年基金项目,翁贝托·埃科文艺思想研究,12YJC752038,于晓峰
2888,外国文学,四川师范大学,青年基金项目,"从形式主义文本到意识形态对话：欧美后现代元小说的实
践及理论研究",12YJC752017,李丹
2889,外国文学,苏州科技学院,青年基金项目,移情视阈下的伊恩·麦克尤恩小说研究,12YJC752023,罗媛
2890,外国文学,天津财经大学,青年基金项目,日本江户时代滑稽本研究,12YJC752040,张海萌
2891,外国文学,武汉科技大学,青年基金项目,美国作家保罗·奥斯特小说研究,12YJC752018,李金云
2892,外国文学,湘潭大学,青年基金项目,后民权运动时期美国少数族裔女性小说中的记忆研究,12YJC752015,蒋欣欣
2893,外国文学,肇庆学院,青年基金项目,当代俄罗斯文学中的苏联记忆,12YJC752002,陈爱香
2894,外国文学,浙江理工大学,青年基金项目,雷蒙·威廉斯：文化研究与“希望的资源”,12YJC752011,何卫华
2895,外国文学,浙江树人学院,青年基金项目,"文学、宗教和政治：日本中世诗僧的多元身份研究——以
绝海中津为代表",12YJC752027,任萍
2896,外国文学,郑州大学,青年基金项目,“沉默的美学”视阈下的桑塔格小说创作研究,12YJC752044,张莉
2897,外国文学,中国海洋大学,青年基金项目,历史文化视域下的当代日本代表作家中国观问题研究,12YJC752045,张小玲
2898,外国文学,中国民航大学,青年基金项目,勃朗特姐妹的宗教人格和宗教体验,12YJC752042,张静波
2899,外国文学,"中国石油大学（华
东）",青年基金项目,俄国翻译思想及理论的文学传统研究,12YJC752016,靳芳
2900,外国文学,中国药科大学,青年基金项目,特里·伊格尔顿后期批评理论研究,12YJC752046,赵光慧
2901,外国文学,中南大学,青年基金项目,薇拉·凯瑟的边疆：美国边疆传统的沿承与拓展,12YJC752032,许燕
2902,外国文学,重庆交通大学,青年基金项目,山姆.谢泼德戏剧的男性身份研究,12YJC752014,姜萌萌
2903,外国文学,重庆师范大学,青年基金项目,英美现代主义诗歌批评史,12YJC752030,王庆
2904,外国文学,重庆师范大学,青年基金项目,皮尔斯符号学研究,12YJC752034,颜青
2905,外国文学,重庆文理学院,青年基金项目,多丽丝.莱辛作品家庭伦理思想研究,12YJC752035,杨颖
2906,心理学,北华大学,规划基金项目,"开设改善就业应对方式课程对大学生就业压力进行干预的
研究",12YJA190014,刘蕾
2907,心理学,北京中医药大学,规划基金项目,中医情志疗法对大学生阈下抑郁的干预研究,12YJA190010,孔军辉
2908,心理学,东北师范大学,规划基金项目,强迫症状者元记忆功能损伤及其干预研究,12YJA190008,姜英杰
2909,心理学,福建师范大学,规划基金项目,学业不良儿童前瞻记忆的特点、机制与干预,12YJA190002,陈幼贞
2910,心理学,赣南医学院,规划基金项目,不同运动类型对学龄儿童注意机制的影响研究,12YJA190017,唐宏
2911,心理学,广东技术师范学院,规划基金项目,汉字输入码的认知加工研究,12YJA190012,李宁
2912,心理学,广州大学,规划基金项目,中国古代精神心理学思想研究,12YJA190004,郭斯萍
2913,心理学,广州大学,规划基金项目,"家庭成员识别机制及亲子关系的行为与神经科学研究：以
摩梭族走婚-通婚家庭儿童为例",12YJA190023,翟洪昌
2914,心理学,华中师范大学,规划基金项目,青少年网络色情图片等级的内隐加工指标评估研究,12YJA190003,高闯
2915,心理学,华中师范大学,规划基金项目,现实社交焦虑影响网络成瘾的发生机制研究,12YJA190006,贺金波
2916,心理学,黄淮学院,规划基金项目,新生代农民工社会适应性实证研究,12YJA190019,王金云
2917,心理学,江南大学,规划基金项目,网络群体心理形成与调控机制研究,12YJA190021,吴正国
2918,心理学,江西师范大学,规划基金项目,"复发性抑郁缓解个体的认知抑制损害机制及认知干预实验
研究",12YJA190015,刘明矾
2919,心理学,辽宁师范大学,规划基金项目,汉语阅读中双字词识别的即时加工过程及脑机制研究,12YJA190016,隋雪
2920,心理学,南开大学,规划基金项目,集体行动的个体参与动机研究,12YJA190011,乐国安
2921,心理学,宁夏大学,规划基金项目,青少年积极道德情绪对利他性道德行为促进机制的研究,12YJA190005,何晓丽
2922,心理学,曲阜师范大学,规划基金项目,优秀运动员知觉预期能力优势的特点及神经机制研究,12YJA190022,杨昭宁
2923,心理学,山东师范大学,规划基金项目,"影响中小学生创造力发展的个体、环境因素及其作用机制
的纵向研究",12YJA190024,张景焕
2924,心理学,陕西师范大学,规划基金项目,儿童青少年创造性的影响因素及培养模式,12YJA190007,胡卫平
2925,心理学,四川师范大学,规划基金项目,国外心理学十年选题及进展研究(2002-2012),12YJA190009,靳宇倡
2926,心理学,天津师范大学,规划基金项目,社会互动中竞争与合作的事件相关脑电位研究,12YJA190020,王益文
2927,心理学,温州大学,规划基金项目,"由对假设检验的批评所引发的一系列争议：问题的澄清与
问题的解决",12YJA190026,仲晓波
2928,心理学,徐州师范大学,规划基金项目,基于前瞻性人格、成就动机的大学生创业意向研究,12YJA190018,王本贤
2929,心理学,肇庆学院,规划基金项目,"农村教师心理弹性现状及其对工作压力、应对方式影响机
制研究",12YJA190025,张旭东
2930,心理学,浙江大学,规划基金项目,效能导向的学习策略行为机制和神经机制及其应用研究,12YJA190001,曹立人
2931,心理学,中国民航大学,规划基金项目,合格飞行学员心理特征及检测评价方法研究,12YJA190013,林岭
2932,心理学,大连理工大学,青年基金项目,"当代中国人信任概念的心理表征、结构和影响因素的实验
研究",12YJC190028,滕国鹏
2933,心理学,广东外语外贸大学,青年基金项目,潜变量交互效应模型分析及其应用,12YJC190031,吴艳
2934,心理学,广州大学,青年基金项目,高校教师教学水平评价的改进——基于概化理论的视角,12YJC190016,黎光明
2935,心理学,河北工业大学,青年基金项目,公共决策中的程序公正及其作用机制研究,12YJC190008,高记
2936,心理学,湖南师范大学,青年基金项目,不同类型匹配度对教师工作效能影响的比较研究,12YJC190024,卢谢峰
2937,心理学,华东理工大学,青年基金项目,和谐社会背景下我国公民社会公正感研究,12YJC190006,方学梅
2938,心理学,华南师范大学,青年基金项目,暴力视频游戏对注意偏向的影响:眼动和fMRI研究,12YJC190040,甄霜菊
2939,心理学,华中师范大学,青年基金项目,"青少年网络成瘾的家庭影响机制及其家庭团体干预的实证
研究",12YJC190023,刘勤学
2940,心理学,华中师范大学,青年基金项目,工作场所中反生产行为发生的心理机制研究,12YJC190027,唐汉瑛
2941,心理学,华中师范大学,青年基金项目,"助人行为两难现象的心理机制：共情、人际信任与自我保
护",12YJC190033,夏勉
2942,心理学,江汉大学,青年基金项目,工作记忆训练对阅读障碍儿童言语加工影响的脑机制研究,12YJC190042,朱冬梅
2943,心理学,鲁东大学,青年基金项目,青少年社会公平判断的偏好调节形成机制,12YJC190020,李文静
2944,心理学,绵阳师范学院,青年基金项目,羌族文化对汶川地震亲历者心理复原的影响机制研究,12YJC190010,韩黎
2945,心理学,南通大学,青年基金项目,混合情绪的发展研究：系统观与神经生理视角,12YJC190026,潘发达
2946,心理学,宁波大学,青年基金项目,整合模型还是启发式模型?基于决策过程的检验,12YJC190029,汪祚军
2947,心理学,宁波大学,青年基金项目,“后见之明偏差”的心理机制：动态惊奇感转化的作用,12YJC190030,魏知超
2948,心理学,曲阜师范大学,青年基金项目,良心行为的内隐性及良心德育育德模式的建构,12YJC190017,李海青
2949,心理学,山东理工大学,青年基金项目,同性恋大学生艾滋病预防干预模型的构建,12YJC190038,于宗富
2950,心理学,山东师范大学,青年基金项目,"初中生羞怯的结构及其影响机制：遗传、环境与自我的作
用",12YJC190004,陈英敏
2951,心理学,山东师范大学,青年基金项目,羞怯个体自我认知的行为和神经生理研究,12YJC190009,韩磊
2952,心理学,陕西师范大学,青年基金项目,语音情绪强度信息加工及神经机制,12YJC190003,陈煦海
2953,心理学,陕西师范大学,青年基金项目,"刻板印象威胁对老年人记忆能力的效应及其与工作自我概
念的关系",12YJC190039,张宝山
2954,心理学,沈阳体育学院,青年基金项目,汉字笔迹不同风格者的人格特点,12YJC190007,冮勇
2955,心理学,天津医科大学,青年基金项目,"老年抑郁情绪问题的早期识别及其形成机制——行为和
ERP的证据",12YJC190005,戴必兵
2956,心理学,天津医科大学,青年基金项目,"以正念为基础的认知治疗（MBCT）预防抑郁症复发效果的
研究",12YJC190019,李建伟
2957,心理学,天津医科大学,青年基金项目,自我损耗影响道德判断和决策的实证研究,12YJC190036,于斌
2958,心理学,武汉大学,青年基金项目,城市老年人友伴群体、社会支持及其影响研究,12YJC190032,武怡堃
2959,心理学,西北民族大学,青年基金项目,"族群态度的发展及其影响因素—以甘南藏族自治州藏族、
汉族青少年为例",12YJC190025,吕庆燕
2960,心理学,西南大学,青年基金项目,基于同步EEG-fMRI的脑网络分析,12YJC190015,雷旭
2961,心理学,西南交通大学,青年基金项目,即时应激过程中与心理复原相关的认知、情绪特征,12YJC190014,雷鸣
2962,心理学,西南民族大学,青年基金项目,经典心理学量表的藏语版修订研究,12YJC190041,郑春
2963,心理学,厦门大学,青年基金项目,新手教师激励风格的可塑性及其影响因素,12YJC190013,赖丹凤
2964,心理学,厦门大学,青年基金项目,汉语阅读障碍儿童形-音捆绑机制研究,12YJC190021,林敏
2965,心理学,信阳师范学院,青年基金项目,社会支持与青少年隐性辍学关系的理论与实证研究,12YJC190012,姜金伟
2966,心理学,浙江理工大学,青年基金项目,触摸式手持移动设备中文输入KLM用户模型研究,12YJC190018,李宏汀
2967,心理学,浙江理工大学,青年基金项目,词汇情绪义与概念义的神经分离及相互作用研究,12YJC190022,刘宏艳
2968,心理学,中国人民大学,青年基金项目,"儿童同伴交往中的资源获得行为及其社会适应意义的跨文
化比较",12YJC190001,曹睿昕
2969,心理学,中山大学,青年基金项目,婴幼儿对社交规则与道德规范的早期理解,12YJC190011,何子静
2970,心理学,中山大学,青年基金项目,"孤独症谱系障碍面孔加工的本族效应：加工模式与神经机
制",12YJC190034,易莉
2971,心理学,重庆大学,青年基金项目,宗教迷信和宗教信仰的认知科学研究,12YJC190002,陈培峰
2972,心理学,重庆师范大学,青年基金项目,时距分层加工的行为学及ERP研究,12YJC190035,尹华站
2973,心理学,重庆师范大学,青年基金项目,"流浪未成年人的心理发展特征及心理救助模式研究——以
重庆为例",12YJC190037,于璐
2974,新闻学与传播学,北京师范大学,规划基金项目,传统电视媒体与视听新媒体融合发展模式及路径研究,12YJA860014,王长潇
2975,新闻学与传播学,长安大学,规划基金项目,国家利益视域下学术期刊国际化出版研究,12YJA860023,杨琦
2976,新闻学与传播学,东北师范大学,规划基金项目,植入式广告存在的问题及其预防、监管研究,12YJA860031,张淑燕
2977,新闻学与传播学,福建师范大学,规划基金项目,广告传播的社会责任研究,12YJA860009,刘泓
2978,新闻学与传播学,广西师范大学,规划基金项目,桂林抗战文化城翻译出版研究,12YJA860026,袁斌业
2979,新闻学与传播学,贵州财经学院,规划基金项目,民族村镇广播电视公共服务体系研究,12YJA860003,顾雪松
2980,新闻学与传播学,河北师范大学,规划基金项目,"价值重构与角色重塑-地方政府新闻发布制度解困的路径
研究",12YJA860015,王春玲
2981,新闻学与传播学,黑龙江大学,规划基金项目,从彼得到普京：俄罗斯书刊检查的实践与评价,12YJA860007,李淑华
2982,新闻学与传播学,湖北大学,规划基金项目,低信任环境下的网络广告信号传递有效性研究,12YJA860012,阮丽华
