0,1,2,3,4,5,6
1759,经济学,甘肃农业大学,规划基金项目,"欠发达地区农民专业合作社成长中的寻租行为、异化倾向
与调适策略研究",12YJA790098,马丁丑
1760,经济学,广东海洋大学,规划基金项目,"中国农业企业海外市场进入模式研究——基于农业产业化
国家重点龙头企业样本的实证研究",12YJA790011,陈伟
1761,经济学,广东海洋大学,规划基金项目,我国现代海洋产业融资问题研究,12YJA790211,周昌仕
1762,经济学,广东金融学院,规划基金项目,我国劳动收入占比变化的多维考量及其调整策略,12YJA790130,汪前元
1763,经济学,广东金融学院,规划基金项目,"人民币国际化、人民币FDI与中国产业结构优化的互动机
理研究",12YJA790172,尹亚红
1764,经济学,广东商学院,规划基金项目,基于外部习惯形成下的资产定价模型：理论和实证研究,12YJA790021,邓学斌
1765,经济学,广东商学院,规划基金项目,后人口红利与经济增长后发优势培育研究,12YJA790100,孟令国
1766,经济学,广东商学院,规划基金项目,刘易斯模型的中国动态特征与结构型通胀的内在关联机制,12YJA790112,宋建军
1767,经济学,广东商学院,规划基金项目,中国货币政策与汇率政策动态协调研究,12YJA790142,文彬
1768,经济学,广东商学院,规划基金项目,"微观空间尺度下的会展旅游产业集聚形成机理与演进研究
——以广州为例",12YJA790196,张玲
1769,经济学,广东商学院,规划基金项目,中国政策性农业保险财政补贴效应研究,12YJA790204,张祖荣
1770,经济学,广东商学院,规划基金项目,"自主创新能力的差距、瓶颈与突破：基于中日韩LED产业
的比较研究",12YJA790213,周松兰
1771,经济学,广东商学院,规划基金项目,我国科技创业投融资主体机制创新研究,12YJA790220,朱顺泉
1772,经济学,广西财经学院,规划基金项目,"税收制度社会认同研究——税制变迁衍生社会利益冲突及
其治理视角",12YJA790057,焦耘
1773,经济学,广西财经学院,规划基金项目,"节能减排政策压力下资源富集区产业转型发展的研究——
以桂西地区为例",12YJA790148,夏飞
1774,经济学,广西大学,规划基金项目,中国会计服务出口研究——以中国对东盟的出口为例,12YJA790077,梁淑红
1775,经济学,广州大学,规划基金项目,“中国式幸福”的经济学分析,12YJA790036,龚一萍
1776,经济学,哈尔滨工业大学,规划基金项目,海洋经济区产业协同集聚研究：测度、机制与实现路径,12YJA790044,何青松
1777,经济学,杭州电子科技大学,规划基金项目,"公允价值计量与风险导向审计定价理论模型与实证研究-
基于经济周期视角",12YJA790040,郝玉贵
1778,经济学,杭州电子科技大学,规划基金项目,基于结构模型的中小企业信用风险度量研究,12YJA790058,金辉
1779,经济学,杭州师范大学,规划基金项目,旅游目的地碳源碳汇测算与碳中和风景区建设,12YJA790191,张建春
1780,经济学,杭州师范大学,规划基金项目,财政政策、房地产价格波动与地方财政平衡研究,12YJA790206,赵奉军
1781,经济学,合肥工业大学,规划基金项目,基于空间动态面板数据的EBA模型改进及其应用研究,12YJA790135,王立平
1782,经济学,合肥学院,规划基金项目,基于综合区位熵指数的旅游产业集聚水平比较研究,12YJA790092,柳百萍
1783,经济学,河北金融学院,规划基金项目,正规与非正规信贷市场的分割与整合,12YJA790084,刘洪生
1784,经济学,河北师范大学,规划基金项目,中国式包容性增长的理论体系与实现路径研究,12YJA790031,冯玫
1785,经济学,河海大学,规划基金项目,"发达地区农村金融发展的动态经济效应及其影响因素：长
三角区域经验研究",12YJA790102,潘海英
1786,经济学,河南财经政法大学,规划基金项目,省以下转移支付绩效定量评价与政策研究,12YJA790039,郝秀琴
1787,经济学,河南大学,规划基金项目,"农户信号传递、金融抑制及农贷技术设计——基于河南农
户调查数据的微观视角",12YJA790139,王性玉
1788,经济学,河南科技大学,规划基金项目,"我国粮食主销区对主产区利益补偿理论架构与制度体系研
究",12YJA790180,岳佐华
1789,经济学,河南科技大学,规划基金项目,"产品内分工、贸易利益分配与中国对外贸易失衡机制及对
策研究",12YJA790189,张纪
1790,经济学,湖南大学,规划基金项目,促进高技术服务创新网络发展的税收激励与政策研究,12YJA790006,曹燕萍
1791,经济学,湖南工业大学,规划基金项目,"城市化加速推进背景下中部典型省会城市碳排放的预警与
调控—基于长沙市的实证",12YJA790215,周跃云
1792,经济学,湖南科技大学,规划基金项目,各国主权债务危机比较研究,12YJA790080,廖湘岳
1793,经济学,湖南科技大学,规划基金项目,"人口老龄化背景下异地互动式旅游养老问题研究——以长
株潭城市群为例",12YJA790178,袁开国
1794,经济学,湖南商学院,规划基金项目,新农村绿色物流发展的供应链金融支持模式研究,12YJA790182,曾之明
1795,经济学,湖南涉外经济学院,规划基金项目,我国企业跨国投资经营风险预警与防范系统对策研究,12YJA790075,李一文
1796,经济学,湖南师范大学,规划基金项目,农村中小银行实现双重绩效最大化的路径研究,12YJA790027,范香梅
1797,经济学,"湖南信息职业技术
学院",规划基金项目,我国多功能农业经营体系构成研究,12YJA790035,龚建平
1798,经济学,华东交通大学,规划基金项目,"政府、基金管理人与创业企业家——创业投资引导基金的
政府规制研究",12YJA790175,余得生
1799,经济学,华东师范大学,规划基金项目,"人民币国际化的动力机制、时空路径选择——兼论上海国
际金融中心建设",12YJA790029,方显仓
1800,经济学,华侨大学,规划基金项目,中国式休闲模式研究,12YJA790049,黄安民
1801,经济学,华侨大学,规划基金项目,我国创意城市评价研究,12YJA790095,吕庆华
1802,经济学,华侨大学,规划基金项目,"基于贝叶斯SV-MT和VECM模型的通货膨胀惯性与市场利率
期限结构的协整机制研究",12YJA790147,吴泽福
1803,经济学,华中师范大学,规划基金项目,“空间生产”视野下的武汉城市圈空间增长机制及效应,12YJA790174,余斌
1804,经济学,吉林大学,规划基金项目,马克思流通理论创新研究,12YJA790188,张洪平
1805,经济学,吉林大学,规划基金项目,中国企业跨境交叉上市、公司治理与投资者保护研究,12YJA790207,赵树宽
1806,经济学,暨南大学,规划基金项目,"城市网络视角的城市竞争力变动与城市群一体化演进耦合
机理研究—以大珠三角城市群为例",12YJA790017,程玉鸿
1807,经济学,暨南大学,规划基金项目,贷款拨备会计基本理论及我国相关政策与实务改革研究,12YJA790023,丁友刚
1808,经济学,嘉兴学院,规划基金项目,全球价值链下中国制造业国际分工地位的测度与提升研究,12YJA790122,唐铁球
1809,经济学,江汉大学,规划基金项目,后林改时期林业合作经济组织制度创新研究,12YJA790216,朱春燕
1810,经济学,江苏大学,规划基金项目,增加农民土地财产性收入问题研究,12YJA790060,金丽馥
1811,经济学,江苏大学,规划基金项目,"产业共生视角下物流业与制造业联动发展的利益分配机制
研究",12YJA790123,田刚
1812,经济学,江苏技术师范学院,规划基金项目,"异质性视角下FDI溢出技术的吸收主体定位与最佳区间探
讨",12YJA790126,田泽永
1813,经济学,江苏技术师范学院,规划基金项目,"民营经济系统的复杂适应机制和能力研究—基于苏南的经
验数据",12YJA790153,谢忠秋
1814,经济学,江西财经大学,规划基金项目,基于公共利益视角的食品安全规制的制度设计,12YJA790079,廖卫东
1815,经济学,江西财经大学,规划基金项目,我国公共投资效率问题研究,12YJA790165,杨飞虎
1816,经济学,江西科技师范学院,规划基金项目,"基于农户视角的深化集体林权制度改革政策满意度分析与
完善设计——以江西为例",12YJA790221,朱再昱
1817,经济学,江西理工大学,规划基金项目,重要矿产资源海外开发战略选区风险评价技术研究,12YJA790208,郑明贵
1818,经济学,江西农业大学,规划基金项目,"CDM林业碳汇项目对农户（林场）投资行为的影响及决策
模型研究——以江西为例",12YJA790198,张小有
1819,经济学,金陵科技学院,规划基金项目,基于自组织理论的中国旅游产业融合研究,12YJA790163,严伟
1820,经济学,丽水学院,规划基金项目,我国流通业与制造业协同演进机制与优化研究,12YJA790045,何永达
1821,经济学,南昌大学,规划基金项目,我国自主品牌汽车产业升级的多重模式研究,12YJA790099,马卫
1822,经济学,南京财经大学,规划基金项目,"FDI技术转移、技术溢出与国内公司的自主创新——理论
与实证研究",12YJA790055,黄志勇
1823,经济学,南京财经大学,规划基金项目,服务创新驱动下我国旅游产业转型与升级的动力机制研究,12YJA790158,徐文燕
1824,经济学,南京理工大学,规划基金项目,"中国证券市场信息交易风险定价研究——基于投资者异质
的视角",12YJA790091,刘玉灿
1825,经济学,南京林业大学,规划基金项目,农户商品林林地转出行为决策过程研究,12YJA790003,蔡志坚
1826,经济学,南京农业大学,规划基金项目,"粮食主产区改善农村水利基础设施问题研究——基于投融
资模式创新的视角",12YJA790162,许朗
1827,经济学,南京审计学院,规划基金项目,"金融中介、空间溢出与区域协调发展：基于空间经济的理
论及实证研究",12YJA790014,陈祖华
1828,经济学,南京审计学院,规划基金项目,基于人工免疫神经网络的省域经济安全预警机制研究,12YJA790047,后小仙
1829,经济学,南京审计学院,规划基金项目,企业家精神视角下的县域农民创业金融支持体系研究,12YJA790093,卢亚娟
1830,经济学,南京审计学院,规划基金项目,中国国民福祉的地区差距及其协调机制研究,12YJA790128,万树
1831,经济学,南京信息工程大学,规划基金项目,"市场化生态补偿标准及补偿执行机制政策设计-基于环境
管理会计的研究视角",12YJA790176,袁广达
1832,经济学,南开大学,规划基金项目,基于产业融合理论的中国生产性服务业发展战略研究,12YJA790082,刘纯彬
1833,经济学,南开大学,规划基金项目,公共预算监督绩效的行为经济学分析,12YJA790097,马蔡琛
1834,经济学,南开大学,规划基金项目,政府控股、外国投资和生产效率：中国企业能否赶超？,12YJA790124,田利辉
1835,经济学,南开大学,规划基金项目,"中国物流产业生态效率评价与提升路径——基于能源消耗
与环境污染内生化的视角",12YJA790136,王玲
1836,经济学,南通大学,规划基金项目,"农地整理中农民权益保障问题研究---以江苏省、上海市
为例",12YJA790192,张娟
1837,经济学,曲阜师范大学,规划基金项目,"省域内发展规划边缘区现代农业发展路径研究——以山东
为例",12YJA790066,李传健
1838,经济学,曲阜师范大学,规划基金项目,知识积累与劳动报酬递增：包容性增长的政治经济学研究,12YJA790109,任洲鸿
1839,经济学,山东财政学院,规划基金项目,"转方式调结构背景下促进现代服务业发展的税收政策体系
创新研究",12YJA790103,潘明星
1840,经济学,山东大学,规划基金项目,基于公司治理的商业银行货币政策传导机制研究,12YJA790005,曹廷求
1841,经济学,山东大学,规划基金项目,民国时期中间组织与企业劳资关系研究（1912—1937）,12YJA790059,金京玉
1842,经济学,山东大学,规划基金项目,复杂面板数据的系统建模及应用研究,12YJA790107,任燕燕
1843,经济学,山东大学,规划基金项目,资产规模膨胀、价格波动与我国货币政策的优化研究,12YJA790190,张建波
1844,经济学,山东工商学院,规划基金项目,"我国煤炭产业低碳发展机制及政策取向研究--基于系统动
力学视角",12YJA790120,谭玲玲
1845,经济学,山东建筑大学,规划基金项目,城市群空间结构与产业结构的耦合关系及优化研究,12YJA790019,单宝艳
1846,经济学,山东经济学院,规划基金项目,经济刺激计划的陷阱、财政风险及其应对策略,12YJA790008,陈华
1847,经济学,山东经济学院,规划基金项目,宏观审慎监管框架下我国保险业逆周期政策研究,12YJA790067,李红坤
1848,经济学,山东科技大学,规划基金项目,产业蜕变与产业转型互动机理研究,12YJA790108,任一鑫
1849,经济学,山东理工大学,规划基金项目,"海归在中国自主创新中的作用：基于跨国人力资本流动的
视角",12YJA790071,李平
1850,经济学,山东师范大学,规划基金项目,北极航道通航背景下的北极资源开发中国战略研究,12YJA790159,徐跃通
1851,经济学,山东师范大学,规划基金项目,我国区域协调发展战略和政策的增长趋同效应研究,12YJA790199,张晓青
1852,经济学,陕西理工学院,规划基金项目,基于循环经济的西部承接国内产业转移问题研究,12YJA790043,何龙斌
1853,经济学,陕西师范大学,规划基金项目,日韩东盟6国入境我国旅游与进出口贸易的关系,12YJA790115,孙根年
1854,经济学,陕西师范大学,规划基金项目,"中国加工贸易在全球价值链中的下位与上位—基于中国、
印度和越南外包成本的测算与比较",12YJA790161,许军
1855,经济学,上海财经大学,规划基金项目,"收购型股权投资基金引入国有企业重组转型：机制、效应
与支持制度研究",12YJA790074,李曜
1856,经济学,上海财经大学,规划基金项目,"提高劳动报酬占比的理论、实证与政策：基于CGE模型的
研究",12YJA790086,刘兰娟
1857,经济学,上海大学,规划基金项目,"CP模型的拓展研究——以上海市都心（C）周边区域（P）
产业聚集与扩散效应为例",12YJA790013,陈跃刚
1858,经济学,上海对外贸易学院,规划基金项目,内部控制规范实施有效性与内部控制质量评价体系研究,12YJA790015,程安林
1859,经济学,上海金融学院,规划基金项目,"全球化背景下中国外向直接投资的深远影响及我国政府和
企业的行为选择",12YJA790170,杨新房
1860,经济学,上海金融学院,规划基金项目,中国政府采购市场开放风险与防范,12YJA790205,章辉
1861,经济学,上海立信会计学院,规划基金项目,政治联系、隐性激励及其经济后果,12YJA790197,张奇峰
1862,经济学,绍兴文理学院,规划基金项目,"工业化、城镇化与农业现代化“三化同步”发展：内在机
理、战略路径与制度创新",12YJA790177,袁海平
1863,经济学,深圳大学,规划基金项目,"科技研发资助对中小企业自主创新的激励效应及政策建议
——基于深圳的实证研究",12YJA790194,张克听
1864,经济学,沈阳大学,规划基金项目,我国高新技术产业自主创新与产业集群协同发展研究,12YJA790137,王明友
1865,经济学,沈阳化工大学,规划基金项目,区域特色战略性新兴产业选择及政策体系研究,12YJA790203,张展
1866,经济学,沈阳建筑大学,规划基金项目,城市综合承载力测算与预警机制研究,12YJA790063,孔凡文
1867,经济学,首都经济贸易大学,规划基金项目,企业会计准则实施的经济后果研究,12YJA790089,刘文辉
1868,经济学,四川大学,规划基金项目,碳约束下中国包容性增长的路径选择研究,12YJA790056,蒋瑛
1869,经济学,苏州科技学院,规划基金项目,"欧债危机和美国极度宽松货币政策背景下的人民币国际化
路径研究",12YJA790129,万正晓
1870,经济学,天津财经大学,规划基金项目,中国出口的超常规增长——基于市场扭曲的视角,12YJA790033,耿伟
1871,经济学,天津财经大学,规划基金项目,FDI对中国制造业垂直专业化地位的影响,12YJA790068,李宏
1872,经济学,天津财经大学,规划基金项目,内部控制与独立审计的耦合效应研究：财务重述视角,12YJA790193,张俊民
1873,经济学,天津大学,规划基金项目,我国个人所得税收入分配调节作用的实证分析,12YJA790004,曹桂全
1874,经济学,天津农学院,规划基金项目,"农地权益视阈的新生代农民工渐进性市民化可行性与路径
选择",12YJA790085,刘洪银
1875,经济学,铜陵学院,规划基金项目,"主体功能区视阈下的城乡土地置换问题研究——以皖江城
市带为例",12YJA790157,徐诗举
1876,经济学,潍坊学院,规划基金项目,"社会偏好、雇佣保护与劳动契约行为：基于比较制度实验
的研究",12YJA790133,王光荣
1877,经济学,武汉大学,规划基金项目,中国出口技术复杂度的演进机理研究,12YJA790054,黄永明
1878,经济学,武汉大学,规划基金项目,"董事会治理，经理人薪酬与企业投资效率研究——基于经
理人短视行为的视角",12YJA790150,谢珺
1879,经济学,武汉理工大学,规划基金项目,中美失业治理比较研究,12YJA790116,孙强
1880,经济学,武汉理工大学,规划基金项目,基于对外直接投资的企业经营要素流动机理与模式研究,12YJA790138,王恕立
1881,经济学,武汉理工大学,规划基金项目,我国现代服务业政策绩效评价及发展政策研究,12YJA790155,徐宏毅
1882,经济学,西安财经学院,规划基金项目,基于系统动力机制的货币政策调控房价研究,12YJA790048,胡碧
1883,经济学,西安交通大学,规划基金项目,基于包容性增长的西部地区民营经济可持续发展研究,12YJA790088,刘儒
1884,经济学,西安交通大学,规划基金项目,我国商业银行反洗钱机制及其有效性评价研究,12YJA790184,张成虎
1885,经济学,西北师范大学,规划基金项目,区域产业转移对承接地技术创新的溢出效应,12YJA790037,关爱萍
1886,经济学,西北政法大学,规划基金项目,"结构调整、就业与经济可持续增长：基于转型期的理论分
析与中国经验的实证",12YJA790007,陈锋
1887,经济学,西南财经大学,规划基金项目,财务会计概念框架研究,12YJA790106,任世驰
1888,经济学,西南财经大学,规划基金项目,"地方投融资平台的规范发展与风险防范研究：基于国有投
资动态经济效应的分析视角",12YJA790144,吴凡
1889,经济学,西南财经大学,规划基金项目,"中国经济与世界分工体系的冲突——中国社会主义市场经
济模式创新研究",12YJA790167,杨慧玲
1890,经济学,西南财经大学,规划基金项目,"财政政策的消费效应研究——基于中国经验数据的实证分
析",12YJA790173,尹音频
1891,经济学,西南财经大学,规划基金项目,法律、声誉与信任重建:我国转型期诚信危机治理研究,12YJA790179,袁正
1892,经济学,西南大学,规划基金项目,政府诱导型巨灾保险制度研究,12YJA790149,谢家智
1893,经济学,西南交通大学,规划基金项目,基于RAROC的商业银行贷款组合优化及市场化管理研究,12YJA790110,史本山
1894,经济学,西南民族大学,规划基金项目,"新形势下加快形成西部沿边开放格局的机制与对策研究—
—基于兴边睦邻视角",12YJA790127,涂裕春
1895,经济学,西南民族大学,规划基金项目,"农村土地承包经营权抵押融资的区域经验与模式比较—基
于不同区域发展水平的实证",12YJA790181,曾庆芬
1896,经济学,厦门大学,规划基金项目,"公平效率视野下的企业不同要素所有者收入分配失衡分析
及其治理",12YJA790001,柏培文
1897,经济学,厦门大学,规划基金项目,"健康经济增长效应与卫生支出政策优化研究--基于贝叶斯
DSGE模型的分析与应用",12YJA790030,方亚
1898,经济学,厦门大学,规划基金项目,当代金融主导型资本主义经济内在不稳定性问题研究,12YJA790081,林金忠
1899,经济学,厦门大学,规划基金项目,城乡一体化大流通体系的构建路径与政策研究,12YJA790083,刘根荣
1900,经济学,厦门大学,规划基金项目,我国经济方式转型的动力机制研究,12YJA790185,张德荣
1901,经济学,厦门大学,规划基金项目,"ISO26000社会责任标准对中国外向型企业的影响及对策研
究",12YJA790209,郑若娟
1902,经济学,厦门大学,规划基金项目,地区竞争、政府治理与产业空间重组研究,12YJA790222,踪家峰
1903,经济学,咸宁学院,规划基金项目,"惠农政策背景下的农地租赁及其合约和制度研究——以江
汉平原为例",12YJA790024,定光平
1904,经济学,湘潭大学,规划基金项目,金融政策对中国房地产周期波动的影响研究,12YJA790062,鞠方
1905,经济学,湘潭大学,规划基金项目,"政府行为、信用环境与银行绩效：基于浏阳农村商业银行
农户信用放款的实证研究",12YJA790121,谭燕芝
1906,经济学,新疆财经大学,规划基金项目,跨越式发展中南疆世居少数民族就业问题研究,12YJA790026,樊亚利
1907,经济学,徐州工程学院,规划基金项目,基于空间分异的我国农村金融改革特色化研究,12YJA790025,董金玲
1908,经济学,许昌学院,规划基金项目,基于CGE模型的我国低碳发展政策构建研究,12YJA790214,周颖杰
1909,经济学,烟台大学,规划基金项目,海洋资源产权冲突及其治理规则的经济学研究,12YJA790072,李强
1910,经济学,扬州市职业大学,规划基金项目,"发达地区土地承包经营权市场化流转的机理、模式与政策
研究——以江苏、浙江为例",12YJA790156,徐美银
1911,经济学,云南财经大学,规划基金项目,"我国反洗钱立法及监管深化研究——以云南边境反洗钱问
题分析为例",12YJA790046,侯合心
1912,经济学,运城学院,规划基金项目,基于金融集聚视角的区域经济协调发展研究,12YJA790050,黄解宇
1913,经济学,浙江财经学院,规划基金项目,村级公共品有效供给的机制创新与实现路径研究,12YJA790134,王奎泉
1914,经济学,浙江大学,规划基金项目,经济风险传导模型与保险市场波动研究,12YJA790053,黄英
1915,经济学,浙江大学,规划基金项目,"正规金融与民间金融的比较、交互模式与风险防范——以
浙江省中小企业融资为例",12YJA790201,张雪芳
1916,经济学,"浙江大学宁波理工
学院",规划基金项目,"我国民营风险投资的准入、运行和监管机制研究——以长
三角为例",12YJA790061,荆娴
1917,经济学,浙江工商大学,规划基金项目,前后台分离视角下的旅游区服务系统精益化策略研究,12YJA790009,陈觉
1918,经济学,"浙江工商职业技术
学院",规划基金项目,中国虾产品主要出口市场需求及空间整合研究,12YJA790212,周井娟
1919,经济学,浙江理工大学,规划基金项目,"广义市场不完全视角下农村正规借贷合约安排的机制与绩
效研究",12YJA790183,战明华
1920,经济学,浙江农林大学,规划基金项目,"自然资源与环境约束背景下农业全要素生产率省际间差异
研究",12YJA790038,郭萍
1921,经济学,浙江师范大学,规划基金项目,"中小企业集群潜在融资优势的发挥机制：理论到现实的传
导研究",12YJA790032,高连和
1922,经济学,"中国地质大学（北
京）",规划基金项目,境外矿业投资环境指数结构研究,12YJA790064,雷平
1923,经济学,中国海洋大学,规划基金项目,我国海洋风能产业化实现机制研究,12YJA790020,单春红
1924,经济学,中国海洋大学,规划基金项目,"海域资源市场化配置的方式选择、制度安排与实施路径研
究",12YJA790168,杨林
1925,经济学,中国农业大学,规划基金项目,生物技术应用的社会规制问题研究,12YJA790140,王玉斌
1926,经济学,中国农业大学,规划基金项目,"基于主体功能区规划的欠发达地区土地利用模式与区域经
济发展耦合研究-以贵州省为例",12YJA790217,朱道林
1927,经济学,中国人民大学,规划基金项目,新生代农民工市民化过程中的制度冲突与协调问题研究,12YJA790051,黄锟
1928,经济学,中国人民大学,规划基金项目,"中国节能管理城市分类技术与管理策略研究——基于287
个城市面板数据的分析",12YJA790111,宋国君
1929,经济学,中国人民大学,规划基金项目,"城市群人口空间分布机制及优化研究——以京津冀城市群
为例",12YJA790202,张耀军
1930,经济学,中国政法大学,规划基金项目,体制和规制约束条件下美国金融制度变迁研究,12YJA790143,巫云仙
1931,经济学,中南财经政法大学,规划基金项目,20世纪中国经济史学发展研究,12YJA790171,杨祖义
1932,经济学,中南财经政法大学,规划基金项目,民国时期（1912-1949）保险思想研究,12YJA790219,朱华雄
1933,经济学,中南大学,规划基金项目,"统筹区域发展战略背景下我国差异化农村金融制度安排与
政策取向研究",12YJA790065,黎翠梅
