0,1,2,3,4,5,6
187,政治学,云南大学,青年基金项目,西南边疆地区山地白族妇女的有序政治参与研究,10XJC810002,贺琳凯
188,中国文学,大理学院,规划基金项目,"云南民族文学与地域文化关系研究——以大理白族文学发
展与民族文化关系研究为例证",10XJA751001,邓家鲜
189,中国文学,乐山师范学院,规划基金项目,英语世界的郭沫若研究,10XJA751005,杨玉英
190,中国文学,西北大学,规划基金项目,"陕西地域文化和文学关系研究--以陕西籍文人及其文学作
品为关照主体",10XJA751002,方蕴华
191,中国文学,西北民族大学,规划基金项目,关陇多民族文化背景下的北周文学研究,10XJA751003,高人雄
192,中国文学,重庆三峡学院,规划基金项目,红色经典与影视艺术关系研究,10XJA751004,申载春
193,中国文学,重庆师范大学,规划基金项目,现代中国古典主义“新诗”理论研究,10XJA751006,赵黎明
194,中国文学,成都理工大学,青年基金项目,宋代进士考试与文学综论,10XJC751007,许瑶丽
195,中国文学,成都学院,青年基金项目,中国文学经典研究的西方视野转换,10XJC751008,殷晓燕
196,中国文学,内蒙古师范大学,青年基金项目,蒙古族古代文学审美意识研究,10XJC751004,娜仁高娃
197,中国文学,四川大学,青年基金项目,西方互文性理论对中国的影响,10XJC751009,赵渭绒
198,中国文学,西北大学,青年基金项目,《唐才子传》之传体诗学研究,10XJC751001,王松涛
199,中国文学,西北大学,青年基金项目,"唐宋转型视域下女性叙写的嬗变——以女性物事为中心的
研究",10XJC751006,田苗
200,中国文学,西华师范大学,青年基金项目,儒学与魏晋南北朝文学互动关系研究,10XJC751005,孙宝
201,中国文学,西南大学,青年基金项目,隋唐五代谶文学研究,10XJC751010,周睿
202,中国文学,云南财经大学,青年基金项目,傣族文学《召树屯（孔雀公主）》百年嬗变研究,10XJC751002,陈孟云
203,中国文学,云南大学,青年基金项目,少数民族神话的传承问题研究——以云南地区为例,10XJC751003,黄静华
204,宗教学,甘肃民族师范学院,规划基金项目,"藏传佛教学经人员教育及管理制度研究——以拉卜楞寺为
例",10XJA730001,房继荣
205,宗教学,乐山师范学院,规划基金项目,道教术语英译研究,10XJA730002,何立芳
206,宗教学,楚雄师范学院,青年基金项目,"多民族共聚地区宗教和谐现状与新农村建设对策研究——
以云南省为例",10XJC730001,曾豪杰
207,宗教学,四川大学,青年基金项目,南宋“《中庸》学”宗教性诠释研究,10XJC730002,麻尧宾
